CELDA_DESTINO ;NOMBRE_CELDA_DESTINO ;N_ORIGEN ;POB_RESID ;POB_LLEGA ;P_POB_LLEGA ;
001A ;Montesinos, Los y Algorfa ;76 ;7903 ;846 ;10,70 ;
001B ;Sant Joan de Vilatorrada y otros municipios ;109 ;14529 ;1048 ;7,21 ;
001M ;Fuentidueña de Tajo y otros municipios ;142 ;5149 ;558 ;10,84 ;
001S ;Real de la Jara, El y otros municipios ;96 ;6733 ;398 ;5,91 ;
001V ;Daimús y otros municipios ;52 ;6277 ;774 ;12,33 ;
002A ;Formentera del Segura y otros municipios ;54 ;9940 ;1159 ;11,66 ;
002B ;Òdena y otros municipios ;200 ;6522 ;1393 ;21,36 ;
002M ;Perales de Tajuña y otros municipios ;129 ;8186 ;741 ;9,05 ;
002S ;Cazalla de la Sierra y Pedroso, El ;49 ;6736 ;263 ;3,90 ;
002V ;Bellreguard y otros municipios ;57 ;8317 ;901 ;10,83 ;
003A ;Bigastro y Jacarilla ;71 ;8755 ;727 ;8,30 ;
003B ;Torre de Claramunt, La y Pobla de Claramunt, La ;81 ;5907 ;646 ;10,94 ;
003M ;Valdilecha y otros municipios ;99 ;8101 ;646 ;7,97 ;
003S ;Guadalcanal y otros municipios ;43 ;4946 ;192 ;3,88 ;
003V ;Gandia (distritos 01 y 03) ;128 ;8396 ;2923 ;34,81 ;
004A ;Cox y otros municipios ;151 ;11819 ;1587 ;13,43 ;
004B ;Capellades y Vallbona d'Anoia ;60 ;6666 ;323 ;4,85 ;
004M ;Anchuelo y otros municipios ;87 ;6361 ;441 ;6,93 ;
004S ;Peñaflor y Puebla de los Infantes, La ;66 ;6647 ;474 ;7,13 ;
004V ;Vilallonga/Villalonga y Ador ;67 ;5778 ;847 ;14,66 ;
005A ;Albatera y San Isidro ;158 ;14265 ;1825 ;12,79 ;
005B ;Mediona y otros municipios ;67 ;5986 ;298 ;4,98 ;
005M ;Lozoyuela-Navas-Sieteiglesias y otros municipios ;109 ;5837 ;561 ;9,61 ;
005S ;Constantina y Navas de la Concepción, Las ;57 ;7455 ;252 ;3,38 ;
005V ;Font d'En Carròs, la y otros municipios ;39 ;5297 ;473 ;8,93 ;
006A ;Fondó de les Neus, el/Hondón de las Nieves y otros municipios ;62 ;7512 ;465 ;6,19 ;
006B ;Subirats y Olesa de Bonesvalls ;121 ;4854 ;658 ;13,56 ;
006S ;Lora del Río y Alcolea del Río ;116 ;22035 ;940 ;4,27 ;
006V ;Real de Gandía y otros municipios ;70 ;8271 ;1061 ;12,83 ;
007A ;Sax y Salinas ;77 ;11446 ;561 ;4,90 ;
007B ;Castellbell i el Vilar y otros municipios ;124 ;6947 ;688 ;9,90 ;
007M ;Buitrago del Lozoya y otros municipios ;98 ;7674 ;435 ;5,67 ;
007S ;Luisiana, La y Cañada Rosal ;62 ;7896 ;369 ;4,67 ;
007V ;Simat de la Valldigna y Benifairó de la Valldigna ;57 ;4900 ;469 ;9,57 ;
008A ;Elda (distritos 02 y 03) ;77 ;7090 ;1501 ;21,17 ;
008B ;Sant Vicenç de Castellet y otros municipios ;155 ;12365 ;801 ;6,48 ;
008M ;Cercedilla y Navacerrada ;85 ;9998 ;577 ;5,77 ;
008S ;Rubio, El y Marinaleda ;34 ;6035 ;190 ;3,15 ;
008V ;Manuel y otros municipios ;53 ;5650 ;388 ;6,87 ;
009A ;Agost y Tibi ;75 ;6372 ;484 ;7,60 ;
009B ;Hostalets de Pierola, Els y Bruc, El ;141 ;5023 ;632 ;12,58 ;
009M ;Robledo de Chavela y otros municipios ;104 ;7963 ;444 ;5,58 ;
009S ;Gilena y Aguadulce ;37 ;5747 ;226 ;3,93 ;
009V ;Pobla Llarga, la y otros municipios ;68 ;6092 ;712 ;11,69 ;
010A ;Biar y otros municipios ;58 ;6991 ;681 ;9,74 ;
010B ;Viladecavalls y Ullastrell ;143 ;9605 ;983 ;10,23 ;
010M ;Navas del Rey y Chapinería ;66 ;5246 ;287 ;5,47 ;
010S ;Estepa y Lora de Estepa ;131 ;13367 ;965 ;7,22 ;
010V ;Genovés y otros municipios ;59 ;5359 ;419 ;7,82 ;
011A ;Busot y otros municipios ;38 ;5837 ;344 ;5,89 ;
011B ;Sant Esteve Sesrovires y Sant Llorenç d'Hortons ;270 ;10025 ;2349 ;23,43 ;
011M ;Navalagamella y otros municipios ;74 ;5907 ;395 ;6,69 ;
011S ;Casariche y Badolatosa ;51 ;8534 ;314 ;3,68 ;
011V ;Llutxent y otros municipios ;68 ;5991 ;479 ;8,00 ;
012A ;Alcoy/Alcoi (distrito 08) y Benifallim ;111 ;10456 ;3226 ;30,85 ;
012B ;Gelida y Castellví de Rosanes ;163 ;9417 ;947 ;10,06 ;
012M ;Quijorna y otros municipios ;82 ;6443 ;440 ;6,83 ;
012S ;Saucejo, El y otros municipios ;101 ;10929 ;362 ;3,31 ;
012V ;Xeraco y Xeresa ;118 ;7823 ;881 ;11,26 ;
013A ;Benilloba y otros municipios ;81 ;5050 ;991 ;19,62 ;
013B ;Cervelló y Palma de Cervelló, La ;149 ;12008 ;1080 ;8,99 ;
013M ;Aldea del Fresno y Villamanta ;79 ;5393 ;410 ;7,60 ;
013S ;Pruna y otros municipios ;42 ;4978 ;242 ;4,86 ;
013V ;Corbera y otros municipios ;81 ;8826 ;778 ;8,81 ;
014A ;Beniarrés y otros municipios ;57 ;5570 ;866 ;15,55 ;
014B ;Canyelles y Olivella ;112 ;8446 ;721 ;8,54 ;
014M ;San Martín de Valdeiglesias y Pelayos de la Presa ;119 ;11055 ;429 ;3,88 ;
014S ;Morón de la Frontera y Coripe ;137 ;28878 ;832 ;2,88 ;
014V ;Albalat de la Ribera y otros municipios ;65 ;7591 ;464 ;6,11 ;
015A ;Muro de Alcoy y otros municipios ;102 ;10792 ;728 ;6,75 ;
015B ;Martorelles y Santa Maria de Martorelles ;210 ;5694 ;1568 ;27,54 ;
015M ;Cadalso de los Vidrios y otros municipios ;81 ;5602 ;297 ;5,30 ;
015S ;Utrera (distritos 02 y 04) ;71 ;11168 ;1153 ;10,32 ;
015V ;Albal y Beniparrell ;168 ;18351 ;2320 ;12,64 ;
016A ;Verger, el y Poblets, els ;56 ;7345 ;642 ;8,74 ;
016B ;Vilanova del Vallès y otros municipios ;205 ;8750 ;1696 ;19,38 ;
016M ;Serranillos del Valle y Batres ;90 ;5849 ;520 ;8,89 ;
016S ;Utrera (distrito 05) y otros municipios ;230 ;22506 ;4288 ;19,05 ;
016V ;Riba-roja de Túria y Loriguilla ;319 ;24289 ;5189 ;21,36 ;
017A ;Beniarbeig y otros municipios ;49 ;5673 ;639 ;11,26 ;
017B ;Sant Vicenç de Montalt y Caldes d'Estrac ;121 ;9389 ;872 ;9,29 ;
017M ;Cubas de la Sagra y Casarrubuelos ;105 ;10191 ;750 ;7,36 ;
017S ;Aznalcázar y Villamanrique de la Condesa ;124 ;9045 ;1406 ;15,54 ;
017V ;Bonrepòs i Mirambell y otros municipios ;93 ;10421 ;1677 ;16,09 ;
018A ;Xaló y otros municipios ;35 ;5536 ;229 ;4,14 ;
018B ;Sant Cebrià de Vallalta y otros municipios ;95 ;8324 ;401 ;4,82 ;
018M ;Chinchón y otros municipios ;109 ;10032 ;560 ;5,58 ;
018S ;Huévar del Aljarafe y otros municipios ;141 ;6188 ;807 ;13,04 ;
018V ;Albuixech y otros municipios ;148 ;10463 ;2064 ;19,73 ;
019A ;Orba y otros municipios ;43 ;5975 ;337 ;5,64 ;
019B ;Sant Pere de Vilamajor y otros municipios ;213 ;17890 ;1225 ;6,85 ;
019M ;Cabrera, La y otros municipios ;83 ;5586 ;421 ;7,54 ;
019S ;Olivares y Albaida del Aljarafe ;87 ;12591 ;696 ;5,53 ;
019V ;Serra y otros municipios ;129 ;7101 ;1360 ;19,15 ;
01AB ;Albacete (distrito 08) y otros municipios ;170 ;12205 ;6425 ;52,64 ;
01AL ;Benahadux y Pechina ;40 ;8419 ;667 ;7,92 ;
01AS ;Vegadeo y otros municipios ;46 ;5701 ;386 ;6,77 ;
01AV ;Ávila (distritos 01 a 03) y otros municipios ;65 ;9600 ;1397 ;14,55 ;
01BA ;San Vicente de Alcántara y Codosera, La ;32 ;7483 ;377 ;5,04 ;
01BI ;Karrantza Harana/Valle de Carranza y otros municipios ;67 ;4534 ;304 ;6,70 ;
01BU ;Burgos (distritos 01, 02 y 04) ;40 ;9342 ;891 ;9,54 ;
01CA ;Torrelavega (distritos 02 y 05) ;73 ;11821 ;992 ;8,39 ;
01CC ;Brozas y otros municipios ;38 ;4890 ;493 ;10,08 ;
01CE ;Ceuta (distrito 06 y sección 004 del distrito 05) ;23 ;15840 ;2165 ;13,67 ;
01CO ;Almodóvar del Río y Guadalcázar ;59 ;9520 ;566 ;5,95 ;
01CR ;Ciudad Real (distrito 05) y otros municipios ;86 ;9780 ;1808 ;18,49 ;
01CS ;Morella y otros municipios ;60 ;5526 ;309 ;5,59 ;
01CU ;Priego y otros municipios ;32 ;4832 ;209 ;4,33 ;
01CZ ;Cádiz (distrito 01) ;46 ;5988 ;517 ;8,63 ;
01CÑ ;Cee y Corcubión ;61 ;9135 ;659 ;7,21 ;
01GC ;Valleseco y otros municipios ;50 ;6727 ;610 ;9,07 ;
01GI ;Sant Gregori y otros municipios ;170 ;7965 ;1650 ;20,72 ;
01GP ;Eskoriatza y Elgeta ;43 ;4299 ;189 ;4,40 ;
01GR ;Fuente Vaqueros y otros municipios ;76 ;11199 ;1094 ;9,77 ;
01GU ;Yunquera de Henares y Fontanar ;88 ;6414 ;379 ;5,91 ;
01HS ;Valle de Hecho y otros municipios ;48 ;4324 ;337 ;7,79 ;
01HU ;Ayamonte y Villablanca ;94 ;23794 ;1052 ;4,42 ;
01JA ;Linares (distritos 02 y 03) ;64 ;12028 ;1597 ;13,28 ;
01LE ;Ponferrada (distritos 04 y 06) y otros municipios ;33 ;4899 ;1026 ;20,94 ;
01LL ;Lleida (distritos 08 y 09) ;149 ;8789 ;4398 ;50,04 ;
01LO ;Fuenmayor y otros municipios ;79 ;8151 ;657 ;8,06 ;
01LU ;Lugo (distrito 08) y otros municipios ;121 ;8165 ;1867 ;22,87 ;
01MA ;Cortes de la Frontera y otros municipios ;51 ;7301 ;318 ;4,36 ;
01ME ;Melilla (distrito 01 y 03) ;15 ;5825 ;689 ;11,83 ;
01MU ;Campos del Río y otros municipios ;59 ;4665 ;550 ;11,79 ;
01NA ;Baztan y otros municipios ;96 ;8345 ;437 ;5,24 ;
01OU ;Coles y Amoeiro ;51 ;5330 ;849 ;15,93 ;
01PA ;Venta de Baños ;81 ;6360 ;733 ;11,53 ;
01PO ;Rodeiro y otros municipios ;73 ;5863 ;765 ;13,05 ;
01SA ;Terradillos y otros municipios ;52 ;6203 ;390 ;6,29 ;
01SG ;Villacastín y otros municipios ;109 ;5441 ;645 ;11,85 ;
01SO ;Covaleda y otros municipios ;23 ;4889 ;351 ;7,18 ;
01TA ;Catllar, El y Secuita, La ;79 ;6138 ;723 ;11,78 ;
01TE ;Albalate del Arzobispo y otros municipios ;54 ;6307 ;302 ;4,79 ;
01TF ;Santa Cruz de Tenerife (distritos 07 y 08) ;66 ;11949 ;1694 ;14,18 ;
01TO ;Méntrida y Valmojado ;181 ;9402 ;771 ;8,20 ;
01VA ;Boecillo y Viana de Cega ;68 ;6238 ;528 ;8,46 ;
01VI ;Ayala/Aiara y otros municipios ;91 ;5983 ;626 ;10,46 ;
01ZA ;Sádaba y otros municipios ;87 ;6687 ;560 ;8,37 ;
01ZM ;Zamora (distrito 04) y otros municipios ;45 ;7585 ;730 ;9,62 ;
020A ;Teulada y Benitachell/Poble Nou de Benitatxell, el ;59 ;15388 ;713 ;4,63 ;
020B ;Granada, La y otros municipios ;97 ;5239 ;718 ;13,70 ;
020M ;Miraflores de la Sierra y Bustarviejo ;86 ;8611 ;502 ;5,83 ;
020S ;Valencina de la Concepción y Castilleja de Guzmán ;114 ;10572 ;1194 ;11,29 ;
020V ;Sagunto/Sagunt (distrito 01) y otros municipios ;110 ;8853 ;880 ;9,94 ;
021A ;Orihuela (distrito 08) y Rafal ;149 ;10096 ;2966 ;29,38 ;
021B ;Olèrdola y Castellet i la Gornal ;155 ;5984 ;1171 ;19,57 ;
021M ;Guadalix de la Sierra y Navalafuente ;59 ;7663 ;345 ;4,50 ;
021S ;Alcalá de Guadaíra (distritos 01 y 02) ;73 ;12053 ;790 ;6,55 ;
021V ;Benifairó de les Valls y otros municipios ;100 ;5429 ;617 ;11,36 ;
022A ;Alfàs del Pi, l' ;62 ;20482 ;2003 ;9,78 ;
022B ;Sant Martí Sarroca y Castellví de la Marca ;68 ;4799 ;481 ;10,02 ;
022M ;Torrelaguna y Redueña ;67 ;5020 ;302 ;6,02 ;
022S ;Osuna y Lantejuela ;129 ;21374 ;1087 ;5,09 ;
022V ;Sagunto/Sagunt (distritos 04, 05 y 08) ;196 ;8565 ;2595 ;30,30 ;
023A ;Almoradí ;117 ;20803 ;1506 ;7,24 ;
023B ;Sant Pere de Riudebitlles y otros municipios ;147 ;5043 ;915 ;18,14 ;
023M ;Talamanca de Jarama y otros municipios ;90 ;6399 ;482 ;7,53 ;
023S ;Alcalá de Guadaíra (distrito 03) ;78 ;13700 ;1024 ;7,47 ;
023V ;Estivella y otros municipios ;124 ;5537 ;600 ;10,84 ;
024A ;Altea ;76 ;22290 ;1773 ;7,95 ;
024B ;Font-rubí y otros municipios ;78 ;4846 ;702 ;14,49 ;
024M ;Valdetorres de Jarama ;61 ;4497 ;312 ;6,94 ;
024S ;Alcalá de Guadaíra (distrito 04) ;336 ;49526 ;7314 ;14,77 ;
024V ;Pedralba y otros municipios ;131 ;6723 ;608 ;9,04 ;
025A ;Aspe ;103 ;20714 ;1235 ;5,96 ;
025B ;Castellar del Vallès y otros municipios ;208 ;31222 ;1827 ;5,85 ;
025M ;Valdeolmos-Alalpardo y otros municipios ;88 ;7140 ;389 ;5,45 ;
025S ;Alcalá del Río ;120 ;12029 ;1263 ;10,50 ;
025V ;Villar del Arzobispo y otros municipios ;54 ;6838 ;388 ;5,67 ;
026A ;Banyeres de Mariola ;61 ;7068 ;593 ;8,39 ;
026B ;Tordera y Fogars de la Selva ;219 ;18667 ;1775 ;9,51 ;
026M ;Ajalvir ;201 ;4712 ;1292 ;27,42 ;
026S ;Algaba, La ;197 ;16374 ;1036 ;6,33 ;
026V ;Ademuz y otros municipios ;18 ;2266 ;68 ;3,00 ;
027A ;Benejúzar ;62 ;5402 ;589 ;10,90 ;
027B ;Palafolls y Santa Susanna ;116 ;12851 ;1589 ;12,36 ;
027M ;Álamo, El ;115 ;9470 ;631 ;6,66 ;
027S ;Almensilla ;61 ;6080 ;502 ;8,26 ;
027V ;Chelva y otros municipios ;84 ;7420 ;521 ;7,02 ;
028A ;Benissa ;59 ;11005 ;789 ;7,17 ;
028B ;Seva y otros municipios ;108 ;6623 ;1098 ;16,58 ;
028M ;Algete ;223 ;20611 ;1382 ;6,71 ;
028S ;Arahal ;169 ;19526 ;1344 ;6,88 ;
028V ;Venta del Moro y otros municipios ;70 ;4369 ;378 ;8,65 ;
029A ;Calp ;73 ;22725 ;843 ;3,71 ;
029B ;Aiguafreda y otros municipios ;86 ;5108 ;349 ;6,83 ;
029M ;Alpedrete ;107 ;14575 ;1353 ;9,28 ;
029S ;Aznalcóllar ;79 ;6091 ;373 ;6,12 ;
029V ;Chiva y Godelleta ;238 ;18656 ;2355 ;12,62 ;
02AB ;Chinchilla de Monte-Aragón y Pozo Cañada ;116 ;7003 ;606 ;8,65 ;
02AL ;Dalías y Balanegra ;41 ;7015 ;1236 ;17,62 ;
02AS ;Allande y otros municipios ;45 ;4655 ;235 ;5,05 ;
02AV ;Ávila (distrito 06) y Berrocalejo de Aragona ;111 ;18437 ;2026 ;10,99 ;
02BA ;Badajoz (distrito 08) y otros municipios ;139 ;21614 ;3238 ;14,98 ;
02BI ;Sopuerta y Galdames ;63 ;3358 ;468 ;13,94 ;
02BU ;Valle de Mena ;71 ;3726 ;325 ;8,72 ;
02CA ;Villaescusa y otros municipios ;101 ;8955 ;1222 ;13,65 ;
02CC ;Malpartida de Cáceres ;34 ;4122 ;212 ;5,14 ;
02CE ;Ceuta (sección 007 y otras secciones del distrito 05) ;18 ;8175 ;485 ;5,93 ;
02CO ;Córdoba (varias secciones) y Victoria, La ;269 ;12808 ;9351 ;73,01 ;
02CR ;Carrión de Calatrava y otros municipios ;62 ;7060 ;349 ;4,94 ;
02CS ;Traiguera y otros municipios ;51 ;5131 ;435 ;8,48 ;
02CU ;Villalba del Rey y otros municipios ;25 ;3698 ;113 ;3,06 ;
02CZ ;Cádiz (distrito 03) ;36 ;6486 ;491 ;7,57 ;
02CÑ ;Muxía y Dumbría ;47 ;7640 ;526 ;6,88 ;
02GC ;Santa Lucía de Tirajana (distritos 01 y 02) y San Bartolomé de Tirajana (distrito 01) ;44 ;12082 ;913 ;7,56 ;
02GI ;Bescanó y otros municipios ;124 ;8613 ;1131 ;13,13 ;
02GP ;Bergara y otros municipios ;136 ;19656 ;1026 ;5,22 ;
02GR ;Alhendín y Malahá, La ;51 ;11130 ;547 ;4,91 ;
02GU ;Yebes y Horche ;56 ;6326 ;275 ;4,35 ;
02HS ;Ayerbe y otros municipios ;83 ;5970 ;806 ;13,50 ;
02HU ;Villanueva de los Castillejos y otros municipios ;78 ;5194 ;496 ;9,55 ;
02JA ;Linares (distritos 01 y 08) y Torreblascopedro ;80 ;17749 ;1749 ;9,85 ;
02LE ;Carracedelo y Toral de los Vados ;41 ;5271 ;464 ;8,80 ;
02LL ;Vielha e Mijaran y otros municipios ;52 ;8290 ;283 ;3,41 ;
02LO ;Albelda de Iregua y otros municipios ;66 ;8520 ;1066 ;12,51 ;
02LU ;Guntín y Lugo (distrito 07) ;55 ;5019 ;594 ;11,84 ;
02MA ;Benaoján y otros municipios ;37 ;5508 ;307 ;5,57 ;
02ME ;Melilla (distrito 04) ;15 ;9117 ;694 ;7,61 ;
02MU ;Villanueva del Río Segura y otros municipios ;82 ;4284 ;738 ;17,23 ;
02NA ;Esteribar y otros municipios ;105 ;5662 ;754 ;13,32 ;
02OU ;Allariz y Taboadela ;58 ;7617 ;503 ;6,60 ;
02PA ;Grijota y otros municipios ;78 ;5785 ;784 ;13,55 ;
02PO ;Forcarei y Lama, A ;66 ;5833 ;371 ;6,36 ;
02SA ;Cabrerizos y otros municipios ;38 ;6598 ;1038 ;15,73 ;
02SG ;Hontanares de Eresma y otros municipios ;83 ;5030 ;617 ;12,27 ;
02SO ;Garray y otros municipios ;50 ;4632 ;997 ;21,52 ;
02TA ;Pallaresos, Els ;48 ;4777 ;308 ;6,45 ;
02TE ;Valderrobres y otros municipios ;55 ;5822 ;268 ;4,60 ;
02TF ;Güímar y Fasnia ;103 ;22976 ;1752 ;7,63 ;
02TO ;Santa Cruz del Retamar y otros municipios ;108 ;6243 ;475 ;7,61 ;
02VA ;Mojados y otros municipios ;65 ;7445 ;364 ;4,89 ;
02VI ;Ribera Baja/Erribera Beitia y otros municipios ;98 ;3604 ;804 ;22,31 ;
02ZA ;Ejea de los Caballeros y Biota ;107 ;17724 ;694 ;3,92 ;
02ZM ;Zamora (distrito 02) y otros municipios ;75 ;21035 ;1786 ;8,49 ;
030A ;Callosa d'en Sarrià ;39 ;7373 ;439 ;5,95 ;
030B ;Castellterçol y otros municipios ;102 ;6165 ;513 ;8,32 ;
030M ;Arroyomolinos ;232 ;31396 ;1875 ;5,97 ;
030S ;Benacazón ;123 ;7241 ;709 ;9,79 ;
030V ;Catadau y otros municipios ;101 ;6308 ;1546 ;24,51 ;
031A ;Callosa de Segura ;80 ;19038 ;1059 ;5,56 ;
031B ;Balenyà y otros municipios ;118 ;6228 ;735 ;11,80 ;
031M ;Becerril de la Sierra ;54 ;5714 ;356 ;6,23 ;
031S ;Bollullos de la Mitación ;109 ;10787 ;1192 ;11,05 ;
031V ;Llombai y otros municipios ;70 ;6383 ;501 ;7,85 ;
032A ;Campello, el ;94 ;28349 ;1664 ;5,87 ;
032B ;Taradell y otros municipios ;137 ;14735 ;881 ;5,98 ;
032M ;Boalo, El ;82 ;7508 ;472 ;6,29 ;
032S ;Bormujos ;122 ;21972 ;1821 ;8,29 ;
032V ;Yátova y otros municipios ;75 ;4886 ;600 ;12,28 ;
033A ;Castalla ;93 ;10124 ;1036 ;10,23 ;
033B ;Tona y otros municipios ;137 ;13603 ;1285 ;9,45 ;
033M ;Brunete ;119 ;10736 ;686 ;6,39 ;
033S ;Brenes ;109 ;12471 ;766 ;6,14 ;
033V ;Cofrentes y otros municipios ;89 ;4868 ;708 ;14,54 ;
034A ;Catral ;75 ;8639 ;831 ;9,62 ;
034B ;Calldetenes y Folgueroles ;67 ;4756 ;801 ;16,84 ;
034M ;Camarma de Esteruelas y Valdeavero ;107 ;8890 ;868 ;9,76 ;
034S ;Burguillos ;100 ;6716 ;579 ;8,62 ;
034V ;Navarrés y otros municipios ;53 ;5527 ;300 ;5,43 ;
035A ;Cocentaina ;90 ;11511 ;1134 ;9,85 ;
035B ;Sant Pere de Torelló y otros municipios ;85 ;6383 ;1098 ;17,20 ;
035M ;Campo Real ;99 ;6210 ;426 ;6,86 ;
035S ;Cabezas de San Juan, Las ;110 ;16417 ;650 ;3,96 ;
035V ;Alcàntera de Xúquer y otros municipios ;92 ;5251 ;746 ;14,21 ;
036A ;Crevillent ;163 ;28952 ;1790 ;6,18 ;
036B ;Sant Quirze de Besora y otros municipios ;54 ;5688 ;499 ;8,77 ;
036M ;Ciempozuelos ;337 ;24592 ;2111 ;8,58 ;
036S ;Camas ;152 ;27509 ;1465 ;5,33 ;
036V ;Anna y otros municipios ;55 ;5333 ;390 ;7,31 ;
037A ;Dénia ;130 ;42166 ;1758 ;4,17 ;
037B ;Sant Hipòlit de Voltregà y Masies de Voltregà, Les ;73 ;6625 ;907 ;13,69 ;
037M ;Cobeña ;101 ;7428 ;405 ;5,45 ;
037S ;Campana, La ;65 ;5276 ;418 ;7,92 ;
037V ;Llosa de Ranes, la y otros municipios ;99 ;7524 ;989 ;13,14 ;
038A ;Dolores ;55 ;7470 ;576 ;7,71 ;
038B ;Gurb y otros municipios ;196 ;5150 ;2191 ;42,54 ;
038M ;Colmenar de Oreja ;90 ;8032 ;662 ;8,24 ;
038S ;Cantillana ;81 ;10684 ;718 ;6,72 ;
038V ;Enguera y Chella ;80 ;7187 ;490 ;6,82 ;
039A ;Finestrat ;75 ;6715 ;1410 ;21,00 ;
039B ;Prats de Lluçanès y otros municipios ;58 ;5648 ;414 ;7,33 ;
039M ;Colmenarejo ;95 ;9130 ;702 ;7,69 ;
039S ;Carmona ;236 ;28531 ;3392 ;11,89 ;
039V ;Mogente/Moixent y otros municipios ;119 ;7311 ;585 ;8,00 ;
03AB ;Madrigueras y Motilleja ;55 ;5223 ;198 ;3,79 ;
03AL ;Láujar de Andarax y otros municipios ;38 ;5941 ;522 ;8,79 ;
03AS ;Boal y otros municipios ;29 ;3581 ;174 ;4,86 ;
03AV ;Ávila (distrito 04) y otros municipios ;94 ;22110 ;1669 ;7,55 ;
03BA ;Talavera la Real y otros municipios ;69 ;9820 ;767 ;7,81 ;
03BI ;Güeñes y otros municipios ;91 ;11351 ;787 ;6,93 ;
03BU ;Alfoz de Quintanadueñas y otros municipios ;72 ;6393 ;716 ;11,20 ;
03CA ;Ribamontán al Mar y otros municipios ;93 ;8663 ;945 ;10,91 ;
03CC ;Casar de Cáceres y Garrovillas de Alconétar ;58 ;6503 ;519 ;7,98 ;
03CE ;Ceuta (distrito 04) ;20 ;20420 ;1046 ;5,12 ;
03CO ;Córdoba (SCD Alcolea y sección 044 del distrito 02) y Obejo ;152 ;9296 ;1363 ;14,66 ;
03CR ;Villarta de San Juan y otros municipios ;68 ;5295 ;415 ;7,84 ;
03CS ;Càlig y otros municipios ;62 ;5931 ;384 ;6,47 ;
03CU ;Huete y otros municipios ;61 ;4830 ;260 ;5,38 ;
03CZ ;Cádiz (distrito 02) ;44 ;5643 ;446 ;7,90 ;
03CÑ ;Carnota y Mazaricos ;78 ;7842 ;817 ;10,42 ;
03GC ;Antigua y Betancuria ;25 ;13219 ;623 ;4,71 ;
03GI ;Vilobí d'Onyar y Riudellots de la Selva ;164 ;5367 ;1517 ;28,27 ;
03GP ;Urretxu y Antzuola ;64 ;8882 ;642 ;7,23 ;
03GR ;Dúrcal y Nigüelas ;59 ;8188 ;555 ;6,78 ;
03GU ;Guadalajara (distrito 04) y Chiloeches ;144 ;16889 ;1391 ;8,24 ;
03HS ;Almudévar y otros municipios ;96 ;4807 ;464 ;9,65 ;
03HU ;Puebla de Guzmán y otros municipios ;48 ;5267 ;232 ;4,40 ;
03JA ;Torredelcampo y Fuerte del Rey ;42 ;15604 ;537 ;3,44 ;
03LE ;Camponaraya y otros municipios ;56 ;7268 ;866 ;11,92 ;
03LL ;Pont de Suert, El y otros municipios ;33 ;4820 ;156 ;3,24 ;
03LO ;Logroño (distritos 01 y 06) ;79 ;8172 ;2394 ;29,30 ;
03LU ;Lugo (distrito 06) y Friol ;58 ;5076 ;816 ;16,08 ;
03MA ;Ojén e Istán ;50 ;5171 ;643 ;12,43 ;
03ME ;Melilla (distrito 05) ;13 ;15863 ;820 ;5,17 ;
03MU ;Abanilla ;76 ;6127 ;714 ;11,65 ;
03NA ;Irurtzun y otros municipios ;101 ;6409 ;501 ;7,82 ;
03OU ;San Cibrao das Viñas y Merca, A ;107 ;7318 ;1757 ;24,01 ;
03PA ;Dueñas y otros municipios ;109 ;4908 ;934 ;19,03 ;
03PO ;Cerdedo-Cotobade y Campo Lameiro ;67 ;7516 ;587 ;7,81 ;
03SA ;Castellanos de Moriscos y otros municipios ;32 ;5676 ;468 ;8,25 ;
03SO ;Ólvega y otros municipios ;124 ;6815 ;530 ;7,78 ;
03TA ;Pobla de Mafumet, La y otros municipios ;124 ;8869 ;1297 ;14,62 ;
03TE ;Castelserás y otros municipios ;73 ;5051 ;301 ;5,96 ;
03TF ;San Miguel de Abona y Vilaflor de Chasna ;89 ;22553 ;2080 ;9,22 ;
03TO ;Camarena y Ventas de Retamosa, Las ;125 ;7325 ;480 ;6,55 ;
03VA ;Aldeamayor de San Martín y Portillo ;90 ;7956 ;631 ;7,93 ;
03VI ;Iruña Oka/Iruña de Oca y otros municipios ;98 ;5943 ;477 ;8,03 ;
03ZA ;San Mateo de Gállego y otros municipios ;53 ;4961 ;406 ;8,18 ;
03ZM ;Zamora (distrito 03) y otros municipios ;69 ;9500 ;1851 ;19,48 ;
040A ;Gata de Gorgos ;36 ;6049 ;467 ;7,72 ;
040B ;Puig-reig y otros municipios ;72 ;5680 ;574 ;10,11 ;
040M ;Colmenar Viejo ;312 ;50752 ;2114 ;4,17 ;
040S ;Castilblanco de los Arroyos ;58 ;4864 ;216 ;4,44 ;
040V ;Aielo de Malferit y otros municipios ;102 ;8821 ;664 ;7,53 ;
041A ;Guardamar del Segura ;86 ;15348 ;859 ;5,60 ;
041B ;Cercs y otros municipios ;61 ;4802 ;832 ;17,33 ;
041M ;Collado Mediano ;76 ;6958 ;469 ;6,74 ;
041S ;Castilleja de la Cuesta ;111 ;17418 ;1185 ;6,80 ;
041V ;Albaida y otros municipios ;105 ;8740 ;1340 ;15,33 ;
042A ;Ibi ;120 ;23489 ;866 ;3,69 ;
042B ;Bagà y otros municipios ;56 ;4618 ;293 ;6,34 ;
042M ;Daganzo de Arriba ;159 ;10205 ;667 ;6,54 ;
042S ;Coria del Río ;157 ;30777 ;1582 ;5,14 ;
042V ;Rótova y otros municipios ;66 ;4430 ;460 ;10,38 ;
043A ;Jávea/Xàbia ;99 ;27604 ;1151 ;4,17 ;
043B ;Gironella y otros municipios ;64 ;8964 ;892 ;9,95 ;
043M ;Escorial, El ;135 ;16162 ;1594 ;9,86 ;
043S ;Coronil, El ;73 ;4746 ;410 ;8,64 ;
043V ;Pobla del Duc, la y otros municipios ;86 ;6360 ;522 ;8,21 ;
044A ;Jijona/Xixona ;77 ;6865 ;553 ;8,06 ;
044B ;Cardona y Sant Mateu de Bages ;45 ;5239 ;187 ;3,57 ;
044M ;Fuente el Saz de Jarama ;112 ;6696 ;599 ;8,95 ;
044S ;Dos Hermanas (distrito 01) ;40 ;11526 ;932 ;8,09 ;
044V ;Montaverner y otros municipios ;104 ;6538 ;1184 ;18,11 ;
045A ;Monforte del Cid ;82 ;8165 ;1064 ;13,03 ;
045B ;Balsareny y Castellnou de Bages ;52 ;4556 ;349 ;7,66 ;
045M ;Galapagar ;199 ;33742 ;2001 ;5,93 ;
045S ;Dos Hermanas (distrito 02) ;90 ;18713 ;2375 ;12,69 ;
045V ;Montserrat y Montroi/Montroy ;104 ;10745 ;759 ;7,06 ;
046A ;Monóvar/Monòver ;47 ;12167 ;615 ;5,05 ;
046B ;Abrera ;300 ;12489 ;2328 ;18,64 ;
046M ;Griñón ;138 ;10319 ;823 ;7,98 ;
046S ;Dos Hermanas (distrito 03) ;129 ;22494 ;1952 ;8,68 ;
046V ;Alfafar y Llocnou de la Corona ;135 ;21008 ;2329 ;11,09 ;
047A ;Mutxamel ;98 ;25352 ;1884 ;7,43 ;
047B ;Alella ;104 ;9801 ;962 ;9,82 ;
047M ;Guadarrama ;165 ;16032 ;1672 ;10,43 ;
047S ;Dos Hermanas (distrito 04) ;145 ;37708 ;3079 ;8,17 ;
047V ;Llíria y otros municipios ;150 ;26221 ;2196 ;8,37 ;
048A ;Novelda ;127 ;25651 ;1619 ;6,31 ;
048B ;Ametlla del Vallès, L' ;154 ;8462 ;1290 ;15,24 ;
048M ;Hoyo de Manzanares ;98 ;8434 ;377 ;4,47 ;
048S ;Dos Hermanas (distrito 05) ;351 ;43527 ;7212 ;16,57 ;
048V ;Museros y Emperador ;136 ;7145 ;1569 ;21,96 ;
049A ;Nucia, la ;69 ;18603 ;1645 ;8,84 ;
049B ;Arenys de Mar ;99 ;15776 ;704 ;4,46 ;
049M ;Humanes de Madrid ;225 ;19743 ;1815 ;9,19 ;
049S ;Écija ;221 ;39873 ;2221 ;5,57 ;
049V ;Oliva y otros municipios ;139 ;27922 ;1778 ;6,37 ;
04AB ;Roda, La y otros municipios ;117 ;17371 ;516 ;2,97 ;
04AL ;Fiñana y otros municipios ;41 ;5593 ;242 ;4,33 ;
04AS ;Tapia de Casariego y Castropol ;83 ;7188 ;866 ;12,05 ;
04AV ;Cebreros y otros municipios ;54 ;7134 ;200 ;2,80 ;
04BA ;Montijo y Torremayor ;63 ;16414 ;999 ;6,09 ;
04BI ;Muskiz y Zierbena ;170 ;8997 ;1467 ;16,31 ;
04BU ;Villalbilla de Burgos y otros municipios ;53 ;4550 ;293 ;6,44 ;
04CA ;Puente Viesgo y San Felices de Buelna ;55 ;5215 ;561 ;10,76 ;
04CC ;Sierra de Fuentes y otros municipios ;37 ;4349 ;272 ;6,25 ;
04CE ;Ceuta (distrito 03) ;31 ;15930 ;1613 ;10,13 ;
04CO ;Villafranca de Córdoba y Carpio, El ;91 ;9254 ;427 ;4,61 ;
04CR ;Manzanares y Llanos del Caudillo ;126 ;18716 ;1048 ;5,60 ;
04CS ;Coves de Vinromà, les y otros municipios ;71 ;5052 ;328 ;6,49 ;
04CU ;Barajas de Melo y otros municipios ;112 ;4901 ;520 ;10,61 ;
04CZ ;Cádiz (distrito 04) ;28 ;4134 ;228 ;5,52 ;
04CÑ ;Cabana de Bergantiños y Laxe ;55 ;7264 ;598 ;8,23 ;
04GC ;Agaete ;48 ;5586 ;417 ;7,47 ;
04GI ;Quart y Fornells de la Selva ;80 ;6374 ;674 ;10,57 ;
04GP ;Mutriku y Mendaro ;82 ;7332 ;667 ;9,10 ;
04GR ;Villa de Otura y Dílar ;66 ;9006 ;993 ;11,03 ;
04GU ;Torrejón del Rey y Galápagos ;54 ;7837 ;233 ;2,97 ;
04HS ;Grañén y otros municipios ;71 ;4779 ;1020 ;21,34 ;
04HU ;Alosno y otros municipios ;53 ;7981 ;609 ;7,63 ;
04JA ;Marmolejo y Lopera ;61 ;10477 ;407 ;3,88 ;
04LE ;Robla, La y Pola de Gordón, La ;45 ;7007 ;244 ;3,48 ;
04LL ;Naut Aran y otros municipios ;19 ;5180 ;92 ;1,78 ;
04LO ;San Asensio y otros municipios ;66 ;5488 ;531 ;9,68 ;
04LU ;Lugo (distritos 04 y 09) ;150 ;22577 ;2870 ;12,71 ;
04MA ;Monda y Guaro ;49 ;4854 ;283 ;5,83 ;
04ME ;Melilla (distrito 02) ;17 ;5322 ;1229 ;23,09 ;
04MU ;Abarán ;76 ;12964 ;1075 ;8,29 ;
04NA ;Orkoien y Cendea de Olza/Oltza Zendea ;85 ;5888 ;1262 ;21,43 ;
04OU ;Pereiro de Aguiar, O y Nogueira de Ramuín ;67 ;8273 ;1372 ;16,58 ;
04PA ;Baltanás y otros municipios ;77 ;4690 ;377 ;8,04 ;
04PO ;Valga y Catoira ;91 ;9204 ;1346 ;14,62 ;
04SA ;Villoria y otros municipios ;59 ;6071 ;381 ;6,28 ;
04SG ;Lastrilla, La y otros municipios ;42 ;5982 ;499 ;8,34 ;
04SO ;Arcos de Jalón y otros municipios ;90 ;5009 ;501 ;10,00 ;
04TA ;Santa Bàrbara y otros municipios ;47 ;7007 ;359 ;5,12 ;
04TE ;Calanda y otros municipios ;35 ;4756 ;147 ;3,09 ;
04TF ;Garachico y Tanque, El ;50 ;7634 ;648 ;8,49 ;
04TO ;Viso de San Juan, El y Chozas de Canales ;110 ;8382 ;568 ;6,78 ;
04VA ;Santovenia de Pisuerga y Cabezón de Pisuerga ;104 ;8193 ;807 ;9,85 ;
04VI ;Zuia y Zigoitia ;95 ;4049 ;680 ;16,79 ;
04ZA ;Villamayor de Gállego y otros municipios ;102 ;5414 ;697 ;12,87 ;
04ZM ;Toro y otros municipios ;94 ;9034 ;532 ;5,89 ;
050A ;Ondara ;60 ;6894 ;857 ;12,43 ;
050B ;Arenys de Munt ;92 ;8931 ;461 ;5,16 ;
050M ;Loeches ;156 ;8791 ;766 ;8,71 ;
050S ;Espartinas ;113 ;15791 ;1513 ;9,58 ;
050V ;Alberic y otros municipios ;145 ;12775 ;1076 ;8,42 ;
051A ;Onil ;54 ;7507 ;493 ;6,57 ;
051B ;Argentona ;172 ;12452 ;1486 ;11,93 ;
051M ;Manzanares el Real ;82 ;8840 ;452 ;5,11 ;
051S ;Fuentes de Andalucía ;32 ;7111 ;148 ;2,08 ;
